{
  "resource": "architecture-interpretation/1.5/conformance",
  "semanticDependencies": [
    "architecture-interpretation/1.5/conformance.schema",
    "architecture-interpretation/1.5/identity-representation-recipes",
    "architecture-interpretation/1.5/required-output-derivations",
    "architecture-interpretation/1.5/rules",
    "authoring/1.7/schema/adr-common.schema",
    "authoring/1.7/schema/adr-logical.schema",
    "authoring/1.7/schema/adr-physical-component.schema",
    "authoring/1.7/schema/adr-physical-system.schema",
    "authoring/1.7/schema/types.schema",
    "normalized-model/2.5/schema/normalized-entity.schema"
  ],
  "authority_only": true,
  "runtime_execution_coverage": false,
  "inherited_conformance": {
    "canonical_resource_key": "architecture-interpretation/1.4/conformance",
    "content_digest": "sha256:54a7ec7287b984ca8949f124f317e38957f24d52fd3ed7f690792ac51bf80418",
    "schema_pointer": ""
  },
  "inherited_cases": [
    {
      "id": "AI14-001",
      "qualification": {
        "canonical_resource_key": "architecture-interpretation/1.4/conformance",
        "content_digest": "sha256:54a7ec7287b984ca8949f124f317e38957f24d52fd3ed7f690792ac51bf80418",
        "schema_pointer": "/cases/0"
      },
      "scope": "unchanged_semantic_obligation_under_actual_inherited_authority"
    },
    {
      "id": "AI14-002",
      "qualification": {
        "canonical_resource_key": "architecture-interpretation/1.4/conformance",
        "content_digest": "sha256:54a7ec7287b984ca8949f124f317e38957f24d52fd3ed7f690792ac51bf80418",
        "schema_pointer": "/cases/1"
      },
      "scope": "unchanged_semantic_obligation_under_actual_inherited_authority"
    },
    {
      "id": "AI14-003",
      "qualification": {
        "canonical_resource_key": "architecture-interpretation/1.4/conformance",
        "content_digest": "sha256:54a7ec7287b984ca8949f124f317e38957f24d52fd3ed7f690792ac51bf80418",
        "schema_pointer": "/cases/2"
      },
      "scope": "unchanged_semantic_obligation_under_actual_inherited_authority"
    },
    {
      "id": "AI14-004",
      "qualification": {
        "canonical_resource_key": "architecture-interpretation/1.4/conformance",
        "content_digest": "sha256:54a7ec7287b984ca8949f124f317e38957f24d52fd3ed7f690792ac51bf80418",
        "schema_pointer": "/cases/3"
      },
      "scope": "unchanged_semantic_obligation_under_actual_inherited_authority"
    },
    {
      "id": "AI14-005",
      "qualification": {
        "canonical_resource_key": "architecture-interpretation/1.4/conformance",
        "content_digest": "sha256:54a7ec7287b984ca8949f124f317e38957f24d52fd3ed7f690792ac51bf80418",
        "schema_pointer": "/cases/4"
      },
      "scope": "unchanged_semantic_obligation_under_actual_inherited_authority"
    },
    {
      "id": "AI14-006",
      "qualification": {
        "canonical_resource_key": "architecture-interpretation/1.4/conformance",
        "content_digest": "sha256:54a7ec7287b984ca8949f124f317e38957f24d52fd3ed7f690792ac51bf80418",
        "schema_pointer": "/cases/5"
      },
      "scope": "unchanged_semantic_obligation_under_actual_inherited_authority"
    },
    {
      "id": "AI14-007",
      "qualification": {
        "canonical_resource_key": "architecture-interpretation/1.4/conformance",
        "content_digest": "sha256:54a7ec7287b984ca8949f124f317e38957f24d52fd3ed7f690792ac51bf80418",
        "schema_pointer": "/cases/6"
      },
      "scope": "unchanged_semantic_obligation_under_actual_inherited_authority"
    },
    {
      "id": "AI14-008",
      "qualification": {
        "canonical_resource_key": "architecture-interpretation/1.4/conformance",
        "content_digest": "sha256:54a7ec7287b984ca8949f124f317e38957f24d52fd3ed7f690792ac51bf80418",
        "schema_pointer": "/cases/7"
      },
      "scope": "unchanged_semantic_obligation_under_actual_inherited_authority"
    },
    {
      "id": "AI14-009",
      "qualification": {
        "canonical_resource_key": "architecture-interpretation/1.4/conformance",
        "content_digest": "sha256:54a7ec7287b984ca8949f124f317e38957f24d52fd3ed7f690792ac51bf80418",
        "schema_pointer": "/cases/8"
      },
      "scope": "unchanged_semantic_obligation_under_actual_inherited_authority"
    },
    {
      "id": "AI14-010",
      "qualification": {
        "canonical_resource_key": "architecture-interpretation/1.4/conformance",
        "content_digest": "sha256:54a7ec7287b984ca8949f124f317e38957f24d52fd3ed7f690792ac51bf80418",
        "schema_pointer": "/cases/9"
      },
      "scope": "unchanged_semantic_obligation_under_actual_inherited_authority"
    },
    {
      "id": "AI14-011",
      "qualification": {
        "canonical_resource_key": "architecture-interpretation/1.4/conformance",
        "content_digest": "sha256:54a7ec7287b984ca8949f124f317e38957f24d52fd3ed7f690792ac51bf80418",
        "schema_pointer": "/cases/10"
      },
      "scope": "unchanged_semantic_obligation_under_actual_inherited_authority"
    },
    {
      "id": "AI14-012",
      "qualification": {
        "canonical_resource_key": "architecture-interpretation/1.4/conformance",
        "content_digest": "sha256:54a7ec7287b984ca8949f124f317e38957f24d52fd3ed7f690792ac51bf80418",
        "schema_pointer": "/cases/11"
      },
      "scope": "unchanged_semantic_obligation_under_actual_inherited_authority"
    },
    {
      "id": "AI14-013",
      "qualification": {
        "canonical_resource_key": "architecture-interpretation/1.4/conformance",
        "content_digest": "sha256:54a7ec7287b984ca8949f124f317e38957f24d52fd3ed7f690792ac51bf80418",
        "schema_pointer": "/cases/12"
      },
      "scope": "unchanged_semantic_obligation_under_actual_inherited_authority"
    },
    {
      "id": "AI14-014",
      "qualification": {
        "canonical_resource_key": "architecture-interpretation/1.4/conformance",
        "content_digest": "sha256:54a7ec7287b984ca8949f124f317e38957f24d52fd3ed7f690792ac51bf80418",
        "schema_pointer": "/cases/13"
      },
      "scope": "unchanged_semantic_obligation_under_actual_inherited_authority"
    },
    {
      "id": "AI14-015",
      "qualification": {
        "canonical_resource_key": "architecture-interpretation/1.4/conformance",
        "content_digest": "sha256:54a7ec7287b984ca8949f124f317e38957f24d52fd3ed7f690792ac51bf80418",
        "schema_pointer": "/cases/14"
      },
      "scope": "unchanged_semantic_obligation_under_actual_inherited_authority"
    },
    {
      "id": "AI14-016",
      "qualification": {
        "canonical_resource_key": "architecture-interpretation/1.4/conformance",
        "content_digest": "sha256:54a7ec7287b984ca8949f124f317e38957f24d52fd3ed7f690792ac51bf80418",
        "schema_pointer": "/cases/15"
      },
      "scope": "unchanged_semantic_obligation_under_actual_inherited_authority"
    },
    {
      "id": "AI14-017",
      "qualification": {
        "canonical_resource_key": "architecture-interpretation/1.4/conformance",
        "content_digest": "sha256:54a7ec7287b984ca8949f124f317e38957f24d52fd3ed7f690792ac51bf80418",
        "schema_pointer": "/cases/16"
      },
      "scope": "unchanged_semantic_obligation_under_actual_inherited_authority"
    },
    {
      "id": "AI14-018",
      "qualification": {
        "canonical_resource_key": "architecture-interpretation/1.4/conformance",
        "content_digest": "sha256:54a7ec7287b984ca8949f124f317e38957f24d52fd3ed7f690792ac51bf80418",
        "schema_pointer": "/cases/17"
      },
      "scope": "unchanged_semantic_obligation_under_actual_inherited_authority"
    },
    {
      "id": "AI14-019",
      "qualification": {
        "canonical_resource_key": "architecture-interpretation/1.4/conformance",
        "content_digest": "sha256:54a7ec7287b984ca8949f124f317e38957f24d52fd3ed7f690792ac51bf80418",
        "schema_pointer": "/cases/18"
      },
      "scope": "unchanged_semantic_obligation_under_actual_inherited_authority"
    },
    {
      "id": "AI14-020",
      "qualification": {
        "canonical_resource_key": "architecture-interpretation/1.4/conformance",
        "content_digest": "sha256:54a7ec7287b984ca8949f124f317e38957f24d52fd3ed7f690792ac51bf80418",
        "schema_pointer": "/cases/19"
      },
      "scope": "unchanged_semantic_obligation_under_actual_inherited_authority"
    },
    {
      "id": "AI14-021",
      "qualification": {
        "canonical_resource_key": "architecture-interpretation/1.4/conformance",
        "content_digest": "sha256:54a7ec7287b984ca8949f124f317e38957f24d52fd3ed7f690792ac51bf80418",
        "schema_pointer": "/cases/20"
      },
      "scope": "unchanged_semantic_obligation_under_actual_inherited_authority"
    },
    {
      "id": "AI14-022",
      "qualification": {
        "canonical_resource_key": "architecture-interpretation/1.4/conformance",
        "content_digest": "sha256:54a7ec7287b984ca8949f124f317e38957f24d52fd3ed7f690792ac51bf80418",
        "schema_pointer": "/cases/21"
      },
      "scope": "unchanged_semantic_obligation_under_actual_inherited_authority"
    },
    {
      "id": "AI14-023",
      "qualification": {
        "canonical_resource_key": "architecture-interpretation/1.4/conformance",
        "content_digest": "sha256:54a7ec7287b984ca8949f124f317e38957f24d52fd3ed7f690792ac51bf80418",
        "schema_pointer": "/cases/22"
      },
      "scope": "unchanged_semantic_obligation_under_actual_inherited_authority"
    },
    {
      "id": "AI14-024",
      "qualification": {
        "canonical_resource_key": "architecture-interpretation/1.4/conformance",
        "content_digest": "sha256:54a7ec7287b984ca8949f124f317e38957f24d52fd3ed7f690792ac51bf80418",
        "schema_pointer": "/cases/23"
      },
      "scope": "unchanged_semantic_obligation_under_actual_inherited_authority"
    },
    {
      "id": "AI14-025",
      "qualification": {
        "canonical_resource_key": "architecture-interpretation/1.4/conformance",